{
  "version": "pose_checkpoints.v1",
  "analysis_id": "cat-construction-fight",
  "source_video_relpath": "sandbox/assets/demo/incoming/cat-construction-fight.mp4",
  "model": "cv_fallback",
  "tool_versions": {
    "python": "3.12.8",
    "opencv": "4.10.0",
    "mediapipe": "unknown",
    "librosa": "unknown",
    "scenedetect": "unknown"
  },
  "checkpoints": [
    {
      "t_sec": 0.0,
      "pose_signature": [
        0.651,
        0.7059,
        0.6706,
        0.5098,
        0.5176,
        0.8118,
        0.4706,
        0.298,
        0.3922,
        0.4667,
        0.4784,
        0.451,
        0.4549,
        0.3412,
        0.3333,
        0.302
      ],
      "confidence": 0.5
    },
    {
      "t_sec": 7.833,
      "pose_signature": [
        0.3804,
        0.4235,
        0.3725,
        0.3294,
        0.3294,
        0.3098,
        0.3529,
        0.2627,
        0.3725,
        0.4078,
        0.5412,
        0.5922,
        0.5922,
        0.5294,
        0.4824,
        0.4353
      ],
      "confidence": 0.5
    },
    {
      "t_sec": 16.5,
      "pose_signature": [
        0.502,
        0.5725,
        0.3608,
        0.6941,
        0.8902,
        0.8588,
        0.8235,
        0.5529,
        0.1255,
        0.1608,
        0.1804,
        0.3176,
        0.6745,
        0.6118,
        0.4196,
        0.3569
      ],
      "confidence": 0.5
    },
    {
      "t_sec": 16.833,
      "pose_signature": [
        0.4,
        0.4667,
        0.3059,
        0.6,
        0.8863,
        0.8275,
        0.8,
        0.4941,
        0.149,
        0.302,
        0.3333,
        0.3412,
        0.5843,
        0.5804,
        0.3569,
        0.3412
      ],
      "confidence": 0.5
    },
    {
      "t_sec": 20.5,
      "pose_signature": [
        0.7216,
        0.7608,
        0.6902,
        0.6784,
        0.6667,
        0.6392,
        0.6039,
        0.4745,
        0.3725,
        0.5961,
        0.6118,
        0.451,
        0.4549,
        0.3529,
        0.3647,
        0.4078
      ],
      "confidence": 0.5
    },
    {
      "t_sec": 25.5,
      "pose_signature": [
        0.6314,
        0.7451,
        0.7098,
        0.6667,
        0.5412,
        0.5451,
        0.6,
        0.5843,
        0.3412,
        0.3647,
        0.3569,
        0.3373,
        0.3294,
        0.3216,
        0.4039,
        0.3216
      ],
      "confidence": 0.5
    },
    {
      "t_sec": 29.167,
      "pose_signature": [
        0.0039,
        0.0039,
        0.0039,
        0.0039,
        0.0039,
        0.0039,
        0.0039,
        0.0039,
        0.0039,
        0.0039,
        0.0078,
        0.0078,
        0.0078,
        0.0078,
        0.0078,
        0.0039
      ],
      "confidence": 0.5
    },
    {
      "t_sec": 30.333,
      "pose_signature": [
        0.4078,
        0.2941,
        0.3804,
        0.298,
        0.3294,
        0.5843,
        0.8941,
        0.8275,
        0.4078,
        0.2784,
        0.3059,
        0.2902,
        0.3098,
        0.6039,
        0.8902,
        0.7294
      ],
      "confidence": 0.5
    },
    {
      "t_sec": 40.333,
      "pose_signature": [
        0.0039,
        0.0039,
        0.0039,
        0.0039,
        0.0039,
        0.0039,
        0.0039,
        0.0039,
        0.0039,
        0.0039,
        0.0039,
        0.0078,
        0.0078,
        0.0078,
        0.0078,
        0.0039
      ],
      "confidence": 0.5
    },
    {
      "t_sec": 41.267,
      "pose_signature": [
        0.0039,
        0.0039,
        0.0039,
        0.0039,
        0.0039,
        0.0039,
        0.0039,
        0.0039,
        0.0039,
        0.0039,
        0.0039,
        0.0078,
        0.0078,
        0.0078,
        0.0078,
        0.0039
      ],
      "confidence": 0.5
    }
  ]
}
