{
  "version": "pose_checkpoints.v1",
  "analysis_id": "cat-server-fight",
  "source_video_relpath": "sandbox/assets/demo/incoming/cat-server-fight.mp4",
  "model": "cv_fallback",
  "tool_versions": {
    "python": "3.12.8",
    "opencv": "4.10.0",
    "mediapipe": "unknown",
    "librosa": "unknown",
    "scenedetect": "unknown"
  },
  "checkpoints": [
    {
      "t_sec": 0.0,
      "pose_signature": [
        0.5294,
        0.4824,
        0.4314,
        0.4,
        0.3882,
        0.4,
        0.5098,
        0.251,
        0.5176,
        0.6118,
        0.5608,
        0.4784,
        0.5137,
        0.5098,
        0.4941,
        0.6196
      ],
      "confidence": 0.5
    },
    {
      "t_sec": 1.667,
      "pose_signature": [
        0.3804,
        0.5098,
        0.4588,
        0.4902,
        0.5059,
        0.6627,
        0.4784,
        0.4235,
        0.3608,
        0.3647,
        0.4588,
        0.4118,
        0.4627,
        0.4863,
        0.3647,
        0.4588
      ],
      "confidence": 0.5
    },
    {
      "t_sec": 2.667,
      "pose_signature": [
        0.4745,
        0.5255,
        0.5294,
        0.6784,
        0.5137,
        0.451,
        0.4314,
        0.4549,
        0.349,
        0.4039,
        0.4235,
        0.5176,
        0.4667,
        0.3529,
        0.502,
        0.5137
      ],
      "confidence": 0.5
    },
    {
      "t_sec": 3.0,
      "pose_signature": [
        0.4902,
        0.549,
        0.5294,
        0.7059,
        0.451,
        0.4196,
        0.5804,
        0.549,
        0.4235,
        0.4118,
        0.5098,
        0.4275,
        0.4431,
        0.4941,
        0.6353,
        0.5294
      ],
      "confidence": 0.5
    },
    {
      "t_sec": 3.5,
      "pose_signature": [
        0.4549,
        0.5294,
        0.5216,
        0.6627,
        0.3686,
        0.4549,
        0.6275,
        0.5804,
        0.4039,
        0.4078,
        0.4824,
        0.4471,
        0.4353,
        0.3451,
        0.451,
        0.451
      ],
      "confidence": 0.5
    },
    {
      "t_sec": 4.0,
      "pose_signature": [
        0.3647,
        0.4235,
        0.4118,
        0.5725,
        0.4431,
        0.349,
        0.3137,
        0.251,
        0.3373,
        0.4745,
        0.451,
        0.4941,
        0.5412,
        0.5255,
        0.5922,
        0.5216
      ],
      "confidence": 0.5
    },
    {
      "t_sec": 6.0,
      "pose_signature": [
        0.3961,
        0.4039,
        0.4118,
        0.3882,
        0.5647,
        0.4314,
        0.3647,
        0.3333,
        0.2392,
        0.3137,
        0.3804,
        0.498,
        0.5294,
        0.5569,
        0.5412,
        0.5804
      ],
      "confidence": 0.5
    },
    {
      "t_sec": 6.333,
      "pose_signature": [
        0.4431,
        0.4784,
        0.4706,
        0.4353,
        0.6745,
        0.4588,
        0.3765,
        0.4392,
        0.2353,
        0.2588,
        0.3686,
        0.3961,
        0.4627,
        0.5098,
        0.451,
        0.4941
      ],
      "confidence": 0.5
    },
    {
      "t_sec": 10.0,
      "pose_signature": [
        0.4118,
        0.4588,
        0.502,
        0.4588,
        0.5725,
        0.6353,
        0.3137,
        0.4039,
        0.1961,
        0.2471,
        0.3608,
        0.4078,
        0.4627,
        0.4706,
        0.451,
        0.3843
      ],
      "confidence": 0.5
    }
  ]
}
