{
  "version": "pose_checkpoints.v1",
  "analysis_id": "dance-loop",
  "source_video_relpath": "sandbox/assets/demo/incoming/dance_loop.mp4",
  "model": "cv_fallback",
  "tool_versions": {
    "python": "3.12.8",
    "opencv": "4.10.0",
    "mediapipe": "unknown",
    "librosa": "unknown",
    "scenedetect": "unknown"
  },
  "checkpoints": [
    {
      "t_sec": 0.0,
      "pose_signature": [
        0.4745,
        0.5686,
        0.8275,
        0.8745,
        0.8235,
        0.6706,
        0.6157,
        0.349,
        0.5412,
        0.7255,
        0.7333,
        0.8235,
        0.7647,
        0.5529,
        0.651,
        0.4549
      ],
      "confidence": 0.5
    },
    {
      "t_sec": 13.333,
      "pose_signature": [
        0.4314,
        0.5608,
        0.851,
        0.8745,
        0.8196,
        0.6667,
        0.5647,
        0.298,
        0.5882,
        0.7647,
        0.6745,
        0.7569,
        0.7608,
        0.5255,
        0.6392,
        0.4784
      ],
      "confidence": 0.5
    },
    {
      "t_sec": 15.0,
      "pose_signature": [
        0.4588,
        0.5686,
        0.8431,
        0.8745,
        0.8157,
        0.6706,
        0.5608,
        0.3059,
        0.5608,
        0.7569,
        0.7294,
        0.7804,
        0.7765,
        0.549,
        0.6353,
        0.4196
      ],
      "confidence": 0.5
    },
    {
      "t_sec": 15.667,
      "pose_signature": [
        0.4667,
        0.5569,
        0.7961,
        0.8784,
        0.8275,
        0.6706,
        0.6078,
        0.3412,
        0.5412,
        0.7216,
        0.7255,
        0.8157,
        0.7569,
        0.5569,
        0.651,
        0.4627
      ],
      "confidence": 0.5
    },
    {
      "t_sec": 18.667,
      "pose_signature": [
        0.4863,
        0.6235,
        0.8745,
        0.8706,
        0.7922,
        0.651,
        0.5725,
        0.3255,
        0.5804,
        0.7569,
        0.7804,
        0.7882,
        0.7804,
        0.5882,
        0.6196,
        0.3765
      ],
      "confidence": 0.5
    },
    {
      "t_sec": 20.333,
      "pose_signature": [
        0.4549,
        0.6353,
        0.8902,
        0.8667,
        0.7686,
        0.6392,
        0.5294,
        0.2902,
        0.6118,
        0.7373,
        0.7725,
        0.7569,
        0.6941,
        0.6,
        0.6039,
        0.4157
      ],
      "confidence": 0.5
    },
    {
      "t_sec": 20.667,
      "pose_signature": [
        0.4627,
        0.6392,
        0.8902,
        0.8667,
        0.7647,
        0.6392,
        0.5333,
        0.2824,
        0.6039,
        0.7373,
        0.8,
        0.7608,
        0.6902,
        0.6118,
        0.5961,
        0.4
      ],
      "confidence": 0.5
    },
    {
      "t_sec": 21.167,
      "pose_signature": [
        0.4549,
        0.6078,
        0.8784,
        0.8745,
        0.7961,
        0.6549,
        0.5529,
        0.298,
        0.5882,
        0.7608,
        0.7373,
        0.7569,
        0.7647,
        0.549,
        0.6235,
        0.4275
      ],
      "confidence": 0.5
    },
    {
      "t_sec": 21.5,
      "pose_signature": [
        0.4627,
        0.6039,
        0.8784,
        0.8745,
        0.8,
        0.6627,
        0.5569,
        0.298,
        0.5765,
        0.7686,
        0.7373,
        0.7647,
        0.7765,
        0.549,
        0.6275,
        0.4235
      ],
      "confidence": 0.5
    },
    {
      "t_sec": 23.6,
      "pose_signature": [
        0.4471,
        0.6471,
        0.8902,
        0.8667,
        0.7647,
        0.6431,
        0.5059,
        0.2824,
        0.6118,
        0.7216,
        0.7882,
        0.7451,
        0.6706,
        0.6078,
        0.5922,
        0.4353
      ],
      "confidence": 0.5
    }
  ]
}
