{
  "version": "pose_checkpoints.v1",
  "analysis_id": "fight-composite",
  "source_video_relpath": "sandbox/assets/demo/incoming/fight_composite.mp4",
  "model": "cv_fallback",
  "tool_versions": {
    "python": "3.12.8",
    "opencv": "4.10.0",
    "mediapipe": "unknown",
    "librosa": "unknown",
    "scenedetect": "unknown"
  },
  "checkpoints": [
    {
      "t_sec": 0.0,
      "pose_signature": [
        0.4392,
        0.2353,
        0.2314,
        0.2039,
        0.2941,
        0.5059,
        0.2431,
        0.3412,
        0.2235,
        0.2392,
        0.2471,
        0.2627,
        0.5373,
        0.6353,
        0.6157,
        0.3804
      ],
      "confidence": 0.5
    },
    {
      "t_sec": 1.833,
      "pose_signature": [
        0.4353,
        0.2275,
        0.2118,
        0.1961,
        0.2902,
        0.502,
        0.2471,
        0.3412,
        0.5098,
        0.5255,
        0.3294,
        0.2667,
        0.5647,
        0.6667,
        0.6235,
        0.3412
      ],
      "confidence": 0.5
    },
    {
      "t_sec": 3.5,
      "pose_signature": [
        0.5882,
        0.4118,
        0.2039,
        0.2196,
        0.4196,
        0.6314,
        0.2549,
        0.3451,
        0.4902,
        0.4667,
        0.2784,
        0.3961,
        0.5333,
        0.5922,
        0.5765,
        0.3412
      ],
      "confidence": 0.5
    },
    {
      "t_sec": 4.0,
      "pose_signature": [
        0.3765,
        0.3255,
        0.3725,
        0.2902,
        0.2549,
        0.4627,
        0.2235,
        0.302,
        0.4118,
        0.4588,
        0.4078,
        0.5412,
        0.5176,
        0.6196,
        0.6235,
        0.4235
      ],
      "confidence": 0.5
    },
    {
      "t_sec": 5.333,
      "pose_signature": [
        0.4353,
        0.2392,
        0.2196,
        0.2039,
        0.302,
        0.5059,
        0.2588,
        0.3686,
        0.2039,
        0.2157,
        0.2275,
        0.2039,
        0.298,
        0.4863,
        0.4118,
        0.3686
      ],
      "confidence": 0.5
    },
    {
      "t_sec": 5.667,
      "pose_signature": [
        0.4392,
        0.2431,
        0.2275,
        0.2039,
        0.3569,
        0.5098,
        0.2588,
        0.3686,
        0.2235,
        0.302,
        0.2824,
        0.2745,
        0.5922,
        0.5569,
        0.4235,
        0.3647
      ],
      "confidence": 0.5
    },
    {
      "t_sec": 6.167,
      "pose_signature": [
        0.4471,
        0.2431,
        0.2314,
        0.2078,
        0.3059,
        0.5137,
        0.2627,
        0.3765,
        0.2157,
        0.2549,
        0.2863,
        0.349,
        0.4627,
        0.5255,
        0.3843,
        0.3804
      ],
      "confidence": 0.5
    },
    {
      "t_sec": 6.5,
      "pose_signature": [
        0.4471,
        0.2431,
        0.2275,
        0.2078,
        0.3059,
        0.5176,
        0.2667,
        0.3804,
        0.2196,
        0.2235,
        0.2353,
        0.4941,
        0.5765,
        0.3373,
        0.3882,
        0.3922
      ],
      "confidence": 0.5
    },
    {
      "t_sec": 6.833,
      "pose_signature": [
        0.4471,
        0.2392,
        0.2275,
        0.2039,
        0.3059,
        0.5255,
        0.2784,
        0.3961,
        0.2196,
        0.2275,
        0.4196,
        0.3294,
        0.2549,
        0.3137,
        0.4196,
        0.4196
      ],
      "confidence": 0.5
    },
    {
      "t_sec": 10.133,
      "pose_signature": [
        0.4549,
        0.2549,
        0.2431,
        0.2196,
        0.3294,
        0.5373,
        0.2863,
        0.4,
        0.2314,
        0.2471,
        0.2549,
        0.2431,
        0.298,
        0.3608,
        0.4588,
        0.4431
      ],
      "confidence": 0.5
    }
  ]
}
