{
  "version": "pose_checkpoints.v1",
  "analysis_id": "cat-blame1",
  "source_video_relpath": "sandbox/assets/demo/incoming/cat-blame1.mp4",
  "model": "cv_fallback",
  "tool_versions": {
    "python": "3.12.8",
    "opencv": "4.10.0",
    "mediapipe": "unknown",
    "librosa": "unknown",
    "scenedetect": "unknown"
  },
  "checkpoints": [
    {
      "t_sec": 0.0,
      "pose_signature": [
        0.4627,
        0.4471,
        0.4902,
        0.4706,
        0.3216,
        0.4,
        0.5804,
        0.5922,
        0.4706,
        0.4824,
        0.5765,
        0.549,
        0.3333,
        0.3451,
        0.3608,
        0.3882
      ],
      "confidence": 0.5
    },
    {
      "t_sec": 10.0,
      "pose_signature": [
        0.4902,
        0.4627,
        0.4549,
        0.5333,
        0.2824,
        0.5765,
        0.6078,
        0.6314,
        0.4549,
        0.5098,
        0.5137,
        0.4784,
        0.4078,
        0.4784,
        0.5137,
        0.6902
      ],
      "confidence": 0.5
    },
    {
      "t_sec": 20.0,
      "pose_signature": [
        0.4706,
        0.4706,
        0.5843,
        0.4627,
        0.5412,
        0.8,
        0.7804,
        0.7529,
        0.7451,
        0.702,
        0.4392,
        0.1765,
        0.2353,
        0.4706,
        0.7137,
        0.7412
      ],
      "confidence": 0.5
    },
    {
      "t_sec": 32.667,
      "pose_signature": [
        0.898,
        0.9098,
        0.8863,
        0.8745,
        0.3529,
        0.3608,
        0.5216,
        0.5216,
        0.8353,
        0.8667,
        0.8667,
        0.8667,
        0.4471,
        0.3843,
        0.5176,
        0.5098
      ],
      "confidence": 0.5
    },
    {
      "t_sec": 33.0,
      "pose_signature": [
        0.9216,
        0.902,
        0.851,
        0.3412,
        0.3804,
        0.5529,
        0.5412,
        0.5725,
        0.8667,
        0.8745,
        0.8588,
        0.4353,
        0.3922,
        0.5294,
        0.5216,
        0.5451
      ],
      "confidence": 0.5
    },
    {
      "t_sec": 37.833,
      "pose_signature": [
        0.6275,
        0.5451,
        0.4667,
        0.4667,
        0.4235,
        0.2667,
        0.3176,
        0.251,
        0.3373,
        0.4314,
        0.3608,
        0.3451,
        0.2588,
        0.149,
        0.1725,
        0.2
      ],
      "confidence": 0.5
    },
    {
      "t_sec": 54.5,
      "pose_signature": [
        0.5765,
        0.5725,
        0.6588,
        0.6627,
        0.7255,
        0.6039,
        0.5412,
        0.4784,
        0.3961,
        0.3725,
        0.4078,
        0.4235,
        0.5765,
        0.7725,
        0.7843,
        0.7412
      ],
      "confidence": 0.5
    },
    {
      "t_sec": 54.833,
      "pose_signature": [
        0.5647,
        0.6078,
        0.6392,
        0.6627,
        0.7333,
        0.7451,
        0.7098,
        0.6863,
        0.3176,
        0.3294,
        0.3137,
        0.6039,
        0.749,
        0.8157,
        0.8392,
        0.7843
      ],
      "confidence": 0.5
    },
    {
      "t_sec": 55.833,
      "pose_signature": [
        0.6588,
        0.5922,
        0.5529,
        0.5765,
        0.5451,
        0.5137,
        0.4745,
        0.5216,
        0.6863,
        0.498,
        0.3098,
        0.4706,
        0.4941,
        0.5137,
        0.5059,
        0.4118
      ],
      "confidence": 0.5
    },
    {
      "t_sec": 65.8,
      "pose_signature": [
        0.6314,
        0.5647,
        0.5216,
        0.5765,
        0.549,
        0.5216,
        0.4784,
        0.5216,
        0.6824,
        0.4275,
        0.2627,
        0.4667,
        0.4941,
        0.5176,
        0.5137,
        0.4118
      ],
      "confidence": 0.5
    }
  ]
}
